<?xml version="1.0" encoding="utf-8"?>
<!ELEMENT users (user*)>
<!ELEMENT user (username, firstname, lastname, gender, signature?)>
<!ELEMENT username (#PCDATA)>
<!ELEMENT firstname (#PCDATA)>
<!ELEMENT lastname (#PCDATA)>
<!ELEMENT gender (#PCDATA)>
<!ELEMENT signature (#PCDATA)>